{
  "$schema": "http://json-schema.org/draft-07/schema#",
  "title": "DesiredSystemIntent",
  "description": "Platform-neutral desired system intent.",
  "type": "object",
  "properties": {
    "desiredSystemIntentID": {
      "type": "string"
    },
    "documentReference": {
      "$ref": "JsonDocumentReference.schema.json"
    },
    "partialIntent": {
      "type": "boolean"
    },
    "diagnosticReference": {
      "$ref": "DiagnosticReference.schema.json"
    }
  },
  "required": [
    "desiredSystemIntentID",
    "documentReference",
    "partialIntent",
    "diagnosticReference"
  ],
  "additionalProperties": false
}
