{
  "desiredSystemIntentID": "example",
  "documentReference": {
    "documentID": "example",
    "role": "OBSERVED",
    "canonicalHash": "example",
    "sourceReference": "example"
  },
  "partialIntent": true,
  "diagnosticReference": {
    "diagnosticID": "example",
    "chainRootReference": "example",
    "diagnosticKind": "STATE_VALIDITY",
    "ruleReferences": [
      {
        "ruleID": "ASH-STATE-VALIDITY-001",
        "sourceReference": "example",
        "ruleFamily": "example"
      }
    ]
  }
}
